<?xml version="1.0" encoding="UTF-8"?>
<TicketDocument xsi:noNamespaceSchemaLocation="ticket.xsd" xmlns:xsi="http://www.w3.org/2001/XMLSchema-instance">
  <Ticket>
    <type>type</type>
    <summary>example summary</summary>
    <description>example description</description>
    <assigneeId>assigneeId</assigneeId>
    <reporterId>reporterId</reporterId>
    <ticketPriority>Medium</ticketPriority>
    <createdDate>2001-12-31T12:00:00</createdDate>
    <dueDate>2001-12-31T12:00:00</dueDate>
  </Ticket>
</TicketDocument>
